"Follow us on","Suivez-nous sur"
"The module is temporarily disabled. Go to <i>Stores > Configuration > Advanced > Developer > Debugger</i> and enable Debugger.","Le module est temporairement désactivé. Allez dans <i>Stores > Configuration > Advanced > Developer > Debugger</i> et activez Debugger."
"Logs and Reports","Journaux et rapports"
"This feature is disabled in the configurations.","Cette fonctionnalité est désactivée dans les configurations."
"Latest report file <strong>%1</strong> from ./var/report/.","Dernier fichier de rapport <strong>%1</strong> à partir de ./var/report/."
"There is no report file available.","Il n'y a pas de fichier de rapport disponible."
"The access to this feature is restricted.","L'accès à cette fonctionnalité est limité."